id,title,description,availability,condition,price,link,image_link,additional_image_link,brand,product_type,custom_label_0,custom_label_1,custom_label_2,custom_label_3,custom_label_4
019e171d-4360-70a8-abda-127a022bf143,Arctic Outdoors — 12 % cashback,Arctic Outdoor udvikler funktionelt og stilrent udendørs tøj og udstyr til både mænd og kvinder — skabt til at klare alt fra vestkystblæst til højfjeldsregn.,in stock,new,0.00 DKK,https://cashbackmedvisa.dk/eshop/butikker/arctic-outdoors/019e171d-4360-70a8-abda-127a022bf143,https://cdn.jsdelivr.net/gh/anders-coder/cashback-meta-feed@main/images/arctic-outdoors_15e577c9_1x1.jpg,"https://cdn.jsdelivr.net/gh/anders-coder/cashback-meta-feed@main/images/arctic-outdoors_15e577c9_4x5.jpg,https://cdn.jsdelivr.net/gh/anders-coder/cashback-meta-feed@main/images/arctic-outdoors_15e577c9_9x16.jpg",Arctic Outdoors,Mode,highest,12 %,Mode,online,12
019e171d-3cb9-70ec-80ec-1f6b66b34213,Kirlund — 12 % cashback,"Kirlund er et dansk brand der designer og sælger køkkenredskaber og tilbehør – fra knivsæt og pizzaspader til elektriske krydderikværne – med fokus på funktion, stil og madglæde.",in stock,new,0.00 DKK,https://cashbackmedvisa.dk/eshop/butikker/kirlund/019e171d-3cb9-70ec-80ec-1f6b66b34213,https://cdn.jsdelivr.net/gh/anders-coder/cashback-meta-feed@main/images/kirlund_2e09827a_1x1.jpg,"https://cdn.jsdelivr.net/gh/anders-coder/cashback-meta-feed@main/images/kirlund_2e09827a_4x5.jpg,https://cdn.jsdelivr.net/gh/anders-coder/cashback-meta-feed@main/images/kirlund_2e09827a_9x16.jpg",Kirlund,Bolig & have,highest,12 %,Bolig & have,online,12
019e1721-7f82-7208-9b11-5a47d0fa5211,Lauridsen Vine — 12 % cashback,"Lauridsen Vine er en dansk vinhandel og webshop, der forhandler et bredt udvalg af vin, spiritus og tilhørende produkter til både hverdag og fest.",in stock,new,0.00 DKK,https://cashbackmedvisa.dk/eshop/butikker/lauridsen-vine/019e1721-7f82-7208-9b11-5a47d0fa5211,https://cdn.jsdelivr.net/gh/anders-coder/cashback-meta-feed@main/images/lauridsen-vine_89ef2258_1x1.jpg,"https://cdn.jsdelivr.net/gh/anders-coder/cashback-meta-feed@main/images/lauridsen-vine_89ef2258_4x5.jpg,https://cdn.jsdelivr.net/gh/anders-coder/cashback-meta-feed@main/images/lauridsen-vine_89ef2258_9x16.jpg",Lauridsen Vine,Dagligvarer,highest,12 %,Dagligvarer,online,12
019e1724-a6d0-7148-9602-58211904b2ee,Øndig — 12 % cashback,"Vores udvalg af smykker er bredt og indeholder både elegante halskæder, funklende smykker og smykker med personlig indgravering. Hvad end du er på udkig efter et nyt smykke til dig selv, eller søger den perfekte gave, kan du finde smykker…",in stock,new,0.00 DKK,https://cashbackmedvisa.dk/eshop/butikker/ondig/019e1724-a6d0-7148-9602-58211904b2ee,https://cdn.jsdelivr.net/gh/anders-coder/cashback-meta-feed@main/images/ondig_a50f9c8f_1x1.jpg,"https://cdn.jsdelivr.net/gh/anders-coder/cashback-meta-feed@main/images/ondig_a50f9c8f_4x5.jpg,https://cdn.jsdelivr.net/gh/anders-coder/cashback-meta-feed@main/images/ondig_a50f9c8f_9x16.jpg",Øndig,Mode,highest,12 %,Mode,online,12
019e16fc-d963-7004-932f-e930c66a8555,iHero — 10 % cashback,"iHero ApS er en Dansk virksomhed, der er ejet af to unge iværksættere. Ejerne bag iHero har en stor interesse indenfor Apple produkter og gadgets generelt, det var også det der fik dem til at starte iHero ApS.",in stock,new,0.00 DKK,https://cashbackmedvisa.dk/eshop/butikker/ihero/019e16fc-d963-7004-932f-e930c66a8555,https://cdn.jsdelivr.net/gh/anders-coder/cashback-meta-feed@main/images/ihero_641d2bac_1x1.jpg,"https://cdn.jsdelivr.net/gh/anders-coder/cashback-meta-feed@main/images/ihero_641d2bac_4x5.jpg,https://cdn.jsdelivr.net/gh/anders-coder/cashback-meta-feed@main/images/ihero_641d2bac_9x16.jpg",iHero,Elektronik,highest,10 %,Elektronik,online,10
019e1707-24b7-73a8-8e57-183b2a1976b6,The Nap — 10 % cashback,"The Nap er en dansk e‑handelsvirksomhed fra København, som designer og sælger specialudviklede sove tilbehør som hovedpuder, dyner og ørepropper med fokus på kvalitet, komfort og bedre søvn. Med over 250.000 tilfredse kunder tilbyder de…",in stock,new,0.00 DKK,https://cashbackmedvisa.dk/eshop/butikker/the-nap/019e1707-24b7-73a8-8e57-183b2a1976b6,https://cdn.jsdelivr.net/gh/anders-coder/cashback-meta-feed@main/images/the-nap_8edfeda2_1x1.jpg,"https://cdn.jsdelivr.net/gh/anders-coder/cashback-meta-feed@main/images/the-nap_8edfeda2_4x5.jpg,https://cdn.jsdelivr.net/gh/anders-coder/cashback-meta-feed@main/images/the-nap_8edfeda2_9x16.jpg",The Nap,Bolig & have,highest,10 %,Bolig & have,online,10
019e1700-acf2-733d-875a-f04a68d798ac,Cartel Copenhagen — 10 % cashback,"Copenhagen Cartel designer tidløst, bæredygtigt tøj til kvinder, der lever dynamiske og holistiske liv. Inspireret af havets styrke og skønhed skaber de produkter, der kombinerer komfort, kvalitet og elegance. Perfekt til alt fra yoga og…",in stock,new,0.00 DKK,https://cashbackmedvisa.dk/eshop/butikker/cartel-copenhagen/019e1700-acf2-733d-875a-f04a68d798ac,https://cdn.jsdelivr.net/gh/anders-coder/cashback-meta-feed@main/images/cartel-copenhagen_8c70829c_1x1.jpg,"https://cdn.jsdelivr.net/gh/anders-coder/cashback-meta-feed@main/images/cartel-copenhagen_8c70829c_4x5.jpg,https://cdn.jsdelivr.net/gh/anders-coder/cashback-meta-feed@main/images/cartel-copenhagen_8c70829c_9x16.jpg",Cartel Copenhagen,Mode,highest,10 %,Mode,online,10
019e171d-45c0-737b-aa6b-00bc6aadd03c,Guldsmed Lind — 8 % cashback,"Guldsmed Lind er en familiedrevet guldsmed med mere end 150 års historie, der forhandler et stort udvalg af smykker som ringe, halskæder og armbånd fra kendte brands og egne design, samt fremstiller håndlavede personlige smykker på eget…",in stock,new,0.00 DKK,https://cashbackmedvisa.dk/eshop/butikker/guldsmed-lind/019e171d-45c0-737b-aa6b-00bc6aadd03c,https://cdn.jsdelivr.net/gh/anders-coder/cashback-meta-feed@main/images/guldsmed-lind_da1fc804_1x1.jpg,"https://cdn.jsdelivr.net/gh/anders-coder/cashback-meta-feed@main/images/guldsmed-lind_da1fc804_4x5.jpg,https://cdn.jsdelivr.net/gh/anders-coder/cashback-meta-feed@main/images/guldsmed-lind_da1fc804_9x16.jpg",Guldsmed Lind,Mode,highest,8 %,Mode,online,08
019e1722-7f3f-72c9-bfc9-e77f56c159e5,Made In Spain — 8 % cashback,"Made in Spain er en webshop, der sælger tøj, sko og accessories med inspiration fra spansk mode og livsstil til moderne mænd og kvinder.",in stock,new,0.00 DKK,https://cashbackmedvisa.dk/eshop/butikker/made-in-spain/019e1722-7f3f-72c9-bfc9-e77f56c159e5,https://cdn.jsdelivr.net/gh/anders-coder/cashback-meta-feed@main/images/made-in-spain_3751fe85_1x1.jpg,"https://cdn.jsdelivr.net/gh/anders-coder/cashback-meta-feed@main/images/made-in-spain_3751fe85_4x5.jpg,https://cdn.jsdelivr.net/gh/anders-coder/cashback-meta-feed@main/images/made-in-spain_3751fe85_9x16.jpg",Made In Spain,Mode,highest,8 %,Mode,online,08
019e16ea-4fd7-70d1-bf38-066a9efb578e,Hunkemöller — 8 % cashback,Hunkemöller er Europas største high street lingeribrand med flere end 880 butikker i mere end 16 lande globalt.,in stock,new,0.00 DKK,https://cashbackmedvisa.dk/eshop/butikker/hunkemoller/019e16ea-4fd7-70d1-bf38-066a9efb578e,https://cdn.jsdelivr.net/gh/anders-coder/cashback-meta-feed@main/images/hunkemoller_0af78903_1x1.jpg,"https://cdn.jsdelivr.net/gh/anders-coder/cashback-meta-feed@main/images/hunkemoller_0af78903_4x5.jpg,https://cdn.jsdelivr.net/gh/anders-coder/cashback-meta-feed@main/images/hunkemoller_0af78903_9x16.jpg",Hunkemöller,Mode,highest,8 %,Mode,online,08
019e171d-4693-7254-86e2-afe915315995,Fodplejebutikken — 8 % cashback,"Fodplejebutikken.dk er en dansk webshop, der tilbyder udstyr og produkter til fodpleje, velvære og sundhed – til både professionelle og privatbrugere.",in stock,new,0.00 DKK,https://cashbackmedvisa.dk/eshop/butikker/fodplejebutikken/019e171d-4693-7254-86e2-afe915315995,https://cdn.jsdelivr.net/gh/anders-coder/cashback-meta-feed@main/images/fodplejebutikken_367aab2f_1x1.jpg,"https://cdn.jsdelivr.net/gh/anders-coder/cashback-meta-feed@main/images/fodplejebutikken_367aab2f_4x5.jpg,https://cdn.jsdelivr.net/gh/anders-coder/cashback-meta-feed@main/images/fodplejebutikken_367aab2f_9x16.jpg",Fodplejebutikken,Skønhed og Pleje,highest,8 %,Skønhed og Pleje,online,08
019e171d-4b2d-70c6-b3c8-2b293d853d42,Blue Glass — 8 % cashback,"BlueGlass.dk er en dansk webshop, der forhandler designglas, glasprodukter og tilbehør til borddækning og hjemmets indretning.",in stock,new,0.00 DKK,https://cashbackmedvisa.dk/eshop/butikker/blue-glass/019e171d-4b2d-70c6-b3c8-2b293d853d42,https://cdn.jsdelivr.net/gh/anders-coder/cashback-meta-feed@main/images/blue-glass_35dab11f_1x1.jpg,"https://cdn.jsdelivr.net/gh/anders-coder/cashback-meta-feed@main/images/blue-glass_35dab11f_4x5.jpg,https://cdn.jsdelivr.net/gh/anders-coder/cashback-meta-feed@main/images/blue-glass_35dab11f_9x16.jpg",Blue Glass,Mode,highest,8 %,Mode,online,08
019e1641-c6e5-7341-8857-f5fb12dd617a,Hotels.com — 8 % cashback,"Hotels.com gør det nemt at finde hoteller verden over. Sammenlign priser, læs anmeldelser og book overnatninger til både storbyferier, familieferier og spontane weekendture. Med appen får du ofte særlige tilbud, bonusovernatninger og…",in stock,new,0.00 DKK,https://cashbackmedvisa.dk/eshop/butikker/hotelscom/019e1641-c6e5-7341-8857-f5fb12dd617a,https://cdn.jsdelivr.net/gh/anders-coder/cashback-meta-feed@main/images/hotelscom_18b4859e_1x1.jpg,"https://cdn.jsdelivr.net/gh/anders-coder/cashback-meta-feed@main/images/hotelscom_18b4859e_4x5.jpg,https://cdn.jsdelivr.net/gh/anders-coder/cashback-meta-feed@main/images/hotelscom_18b4859e_9x16.jpg",Hotels.com,"Rejser, hotel & Transport",popular,8 %,"Rejser, hotel & Transport",online,08
0192d846-f9f1-7168-b28c-c415270d5c5e,Synoptik.dk — 5 % cashback,Synoptik er en af Danmarks største optikerkæder med over 100 butikker fordelt i hele landet.,in stock,new,0.00 DKK,https://cashbackmedvisa.dk/find-partnere?filter[s]=Synoptik,https://cdn.jsdelivr.net/gh/anders-coder/cashback-meta-feed@main/images/synoptik_72ec4d94_1x1.jpg,"https://cdn.jsdelivr.net/gh/anders-coder/cashback-meta-feed@main/images/synoptik_72ec4d94_4x5.jpg,https://cdn.jsdelivr.net/gh/anders-coder/cashback-meta-feed@main/images/synoptik_72ec4d94_9x16.jpg",Synoptik.dk,Optiker,popular,5 %,Optiker,physical,05
0186df34-a142-7353-8485-daaa65af94a3,Løberen.dk — 6 % cashback,"Shop løbetøj og -gear af højeste kvalitet hos Løberen, der specialiserer sig i at udbyde løbeudstyr, der passer til dine individuelle behov. Ny kunde: +6 %.",in stock,new,0.00 DKK,https://cashbackmedvisa.dk/find-partnere?filter[s]=L%C3%B8beren,https://cdn.jsdelivr.net/gh/anders-coder/cashback-meta-feed@main/images/loberen_8c5edd35_1x1.jpg,"https://cdn.jsdelivr.net/gh/anders-coder/cashback-meta-feed@main/images/loberen_8c5edd35_4x5.jpg,https://cdn.jsdelivr.net/gh/anders-coder/cashback-meta-feed@main/images/loberen_8c5edd35_9x16.jpg",Løberen.dk,Sport & fitness,popular,6 %,Sport & fitness,online,06
019e16a9-9fd2-70a6-abbc-cbe789964ac3,Matas — 5 % cashback,"Matas tilbyder et bredt udvalg af skønhedsprodukter, sundhed, personlig pleje og livsstil. Her finder du både kendte brands og egne produkter med hurtig levering, gode tilbud og professionel rådgivning online. Bemærk venligst: Du optjener…",in stock,new,0.00 DKK,https://cashbackmedvisa.dk/eshop/butikker/matas/019e16a9-9fd2-70a6-abbc-cbe789964ac3,https://cdn.jsdelivr.net/gh/anders-coder/cashback-meta-feed@main/images/matas_027907f8_1x1.jpg,"https://cdn.jsdelivr.net/gh/anders-coder/cashback-meta-feed@main/images/matas_027907f8_4x5.jpg,https://cdn.jsdelivr.net/gh/anders-coder/cashback-meta-feed@main/images/matas_027907f8_9x16.jpg",Matas,Skønhed og Pleje,popular,5 %,Skønhed og Pleje,online,05
0186df34-c0e8-7337-b163-76daf4a54d0e,GO DREAM — 5 % cashback,"GO DREAM er en verden fuld af adrenalin, smag, forkælelse, eventyr og sjov. De tilbyder nemlig gavekort til et væld af oplevelser – f.eks. restaurant- og museumsbesøg, hotelophold, indoor skydiving, ekstremsport og massage og spa. Ny kunde: +5 %.",in stock,new,0.00 DKK,https://cashbackmedvisa.dk/find-partnere?filter[s]=GO%20DREAM,https://cdn.jsdelivr.net/gh/anders-coder/cashback-meta-feed@main/images/go-dream_0ed504aa_1x1.jpg,"https://cdn.jsdelivr.net/gh/anders-coder/cashback-meta-feed@main/images/go-dream_0ed504aa_4x5.jpg,https://cdn.jsdelivr.net/gh/anders-coder/cashback-meta-feed@main/images/go-dream_0ed504aa_9x16.jpg",GO DREAM,Oplevelser & underholdning,popular,5 %,Oplevelser & underholdning,online,05
019e1b1f-fc80-714a-95d4-8dad57277be7,HelloFresh — 300 kr cashback,Større smagsoplevelser end nogensinde med opskrifter fra hele verden. Tag på smagsrejse og spar op til 959 kr. + få gratis snacks i 3 måneder. Vilkår for denne partner Denne kampagne kan kun bruges en gang per medlem og gælder kun nye…,in stock,new,0.00 DKK,https://cashbackmedvisa.dk/eshop/butikker/hellofresh/019e1b1f-fc80-714a-95d4-8dad57277be7,https://cdn.jsdelivr.net/gh/anders-coder/cashback-meta-feed@main/images/hellofresh_c6631f5e_1x1.jpg,"https://cdn.jsdelivr.net/gh/anders-coder/cashback-meta-feed@main/images/hellofresh_c6631f5e_4x5.jpg,https://cdn.jsdelivr.net/gh/anders-coder/cashback-meta-feed@main/images/hellofresh_c6631f5e_9x16.jpg",HelloFresh,Dagligvarer,popular,300 kr,Dagligvarer,online,00
019e1617-18e6-715e-aa54-4e942e2a5570,Saxo Boghandel — 3 % cashback,"Saxo er landets største boghandel med et rigt udvalg af bøger. Vi har flere millioner danske og engelske titler på hylderne i alle genrer og i alle tilgængelige formater: Trykte bøger, e-bøger og lydbøger.",in stock,new,0.00 DKK,https://cashbackmedvisa.dk/eshop/butikker/saxo-boghandel/019e1617-18e6-715e-aa54-4e942e2a5570,https://cdn.jsdelivr.net/gh/anders-coder/cashback-meta-feed@main/images/saxo-boghandel_25804912_1x1.jpg,"https://cdn.jsdelivr.net/gh/anders-coder/cashback-meta-feed@main/images/saxo-boghandel_25804912_4x5.jpg,https://cdn.jsdelivr.net/gh/anders-coder/cashback-meta-feed@main/images/saxo-boghandel_25804912_9x16.jpg",Saxo Boghandel,Services,popular,3 %,Services,online,03
019e06d9-908d-7082-af88-4c8898ac7f2f,Mofibo — 70 kr cashback,"Én app - tusindvis af bøger. Gå på eventyr i et kæmpe udvalg med mere end 1 million titler indenfor alle genrer. Læs eller lyt på din smartphone og tablet, hvor i verden det passer dig. Via os får du adgang hele 70 dage (100 timer) til kun…",in stock,new,0.00 DKK,https://cashbackmedvisa.dk/eshop/butikker/mofibo/019e06d9-908d-7082-af88-4c8898ac7f2f,https://cdn.jsdelivr.net/gh/anders-coder/cashback-meta-feed@main/images/mofibo_299d1419_1x1.jpg,"https://cdn.jsdelivr.net/gh/anders-coder/cashback-meta-feed@main/images/mofibo_299d1419_4x5.jpg,https://cdn.jsdelivr.net/gh/anders-coder/cashback-meta-feed@main/images/mofibo_299d1419_9x16.jpg",Mofibo,Oplevelser & underholdning,popular,70 kr,Oplevelser & underholdning,online,00
019a0be3-4ede-7206-bad5-1f730a831417,Sony.dk — 5 % cashback,"Sony forener innovation, lyd og billede i japansk topkvalitet – oplev teknologi i verdensklasse. Ny kunde: +10 %.",in stock,new,0.00 DKK,https://cashbackmedvisa.dk/find-partnere?filter[s]=Sony,https://cdn.jsdelivr.net/gh/anders-coder/cashback-meta-feed@main/images/sony_17a7f617_1x1.jpg,"https://cdn.jsdelivr.net/gh/anders-coder/cashback-meta-feed@main/images/sony_17a7f617_4x5.jpg,https://cdn.jsdelivr.net/gh/anders-coder/cashback-meta-feed@main/images/sony_17a7f617_9x16.jpg",Sony.dk,Elektronik,popular,5 %,Elektronik,online,05
019e1691-3567-737e-ba03-20e8d56a9141,Intersport — 5 % cashback,"Hos INTERSPORT finder du alt til din træning for hele familien. Løb, svømning, yoga, fodbold, håndbold, cykling, gymnastik, og vi kunne blive ved.",in stock,new,0.00 DKK,https://cashbackmedvisa.dk/eshop/butikker/intersport/019e1691-3567-737e-ba03-20e8d56a9141,https://cdn.jsdelivr.net/gh/anders-coder/cashback-meta-feed@main/images/intersport_2473d966_1x1.jpg,"https://cdn.jsdelivr.net/gh/anders-coder/cashback-meta-feed@main/images/intersport_2473d966_4x5.jpg,https://cdn.jsdelivr.net/gh/anders-coder/cashback-meta-feed@main/images/intersport_2473d966_9x16.jpg",Intersport,Sport & Fitness,popular,5 %,Sport & Fitness,online,05
0188e244-a04e-73d3-b25b-f393a0ae2e70,Stelton.dk — 10 % cashback,"Innovativt, dansk designhus 
Stelton er et innovativt, dansk designhus, som skaber tidløse, funktionelle, minimalistiske og langtidsholdbare produkter af høj kvalitet.",in stock,new,0.00 DKK,https://cashbackmedvisa.dk/find-partnere?filter[s]=Stelton,https://cdn.jsdelivr.net/gh/anders-coder/cashback-meta-feed@main/images/stelton_f554e0ef_1x1.jpg,"https://cdn.jsdelivr.net/gh/anders-coder/cashback-meta-feed@main/images/stelton_f554e0ef_4x5.jpg,https://cdn.jsdelivr.net/gh/anders-coder/cashback-meta-feed@main/images/stelton_f554e0ef_9x16.jpg",Stelton.dk,Bolig & have,popular,10 %,Bolig & have,online,10
019e16fc-d573-712f-aaf6-2b018636eb9c,3 Internet — 350 kr cashback,"Ingen gravning i haven, ingen teknikerbesøg – online på kun 5 min. Og til samme pris i hele Danmark. 3 gør det nemt for dig at få lynhurtigt og stabilt internet. Du skal ikke vente på gravning til kabler eller teknikerbesøg. Ingen fiber…",in stock,new,0.00 DKK,https://cashbackmedvisa.dk/eshop/butikker/3-internet/019e16fc-d573-712f-aaf6-2b018636eb9c,https://cdn.jsdelivr.net/gh/anders-coder/cashback-meta-feed@main/images/3-internet_c08327ea_1x1.jpg,"https://cdn.jsdelivr.net/gh/anders-coder/cashback-meta-feed@main/images/3-internet_c08327ea_4x5.jpg,https://cdn.jsdelivr.net/gh/anders-coder/cashback-meta-feed@main/images/3-internet_c08327ea_9x16.jpg",3 Internet,Services,popular,350 kr,Services,online,00
019e1726-26a5-7153-b6f5-2f84bcc9ba14,Anne Brauner — 5 % cashback,"Smykker er designet til at blive båret, og derfor er konceptet baseret på de smukke zirkonia sten, som minder meget om diamanter i deres spil med lyset, ekstraordinære glans, og den fantastiske hårdhed. Det giver rig mulighed for at lege…",in stock,new,0.00 DKK,https://cashbackmedvisa.dk/eshop/butikker/anne-brauner/019e1726-26a5-7153-b6f5-2f84bcc9ba14,https://cdn.jsdelivr.net/gh/anders-coder/cashback-meta-feed@main/images/anne-brauner_519a6c03_1x1.jpg,"https://cdn.jsdelivr.net/gh/anders-coder/cashback-meta-feed@main/images/anne-brauner_519a6c03_4x5.jpg,https://cdn.jsdelivr.net/gh/anders-coder/cashback-meta-feed@main/images/anne-brauner_519a6c03_9x16.jpg",Anne Brauner,Mode,catalog,5 %,Mode,online,05
019e16f7-5a35-72bf-ba35-1265052087d2,Asus — 2 % cashback,"ASUS er passioneret omkring teknologi og drevet af innovation. Vi drømmer, vi tør og vi stræber efter at skabe et enkelt og glædesfyldt digitalt liv for alle. Vi leder altid efter enestående ideer og oplevelser, og vi stræber efter at…",in stock,new,0.00 DKK,https://cashbackmedvisa.dk/eshop/butikker/asus/019e16f7-5a35-72bf-ba35-1265052087d2,https://cdn.jsdelivr.net/gh/anders-coder/cashback-meta-feed@main/images/asus_726a7823_1x1.jpg,"https://cdn.jsdelivr.net/gh/anders-coder/cashback-meta-feed@main/images/asus_726a7823_4x5.jpg,https://cdn.jsdelivr.net/gh/anders-coder/cashback-meta-feed@main/images/asus_726a7823_9x16.jpg",Asus,Elektronik,catalog,2 %,Elektronik,online,02
019e1700-a35b-73ff-990c-3fb646887f2d,AthleticGreens — 6 % cashback,"bygget op omkring vores mission, startede vi AG1 for mere end et årti siden som en måde at bringe omfattende og praktisk daglig ernæring til næsten alle.",in stock,new,0.00 DKK,https://cashbackmedvisa.dk/eshop/butikker/athleticgreens/019e1700-a35b-73ff-990c-3fb646887f2d,https://cdn.jsdelivr.net/gh/anders-coder/cashback-meta-feed@main/images/athleticgreens_1cebb43f_1x1.jpg,"https://cdn.jsdelivr.net/gh/anders-coder/cashback-meta-feed@main/images/athleticgreens_1cebb43f_4x5.jpg,https://cdn.jsdelivr.net/gh/anders-coder/cashback-meta-feed@main/images/athleticgreens_1cebb43f_9x16.jpg",AthleticGreens,Skønhed og Pleje,catalog,6 %,Skønhed og Pleje,online,06
019e1728-f633-7010-a2a1-4776d2f237bb,Avis — 5 % cashback,"Leder du efter frihed på fire hjul? Avis gør det nemt at leje bil via avis.dk, uanset om du rejser, pendler eller planlægger weekendtur, med fleksible løsninger, stærk kvalitet og hurtig booking.",in stock,new,0.00 DKK,https://cashbackmedvisa.dk/eshop/butikker/avis/019e1728-f633-7010-a2a1-4776d2f237bb,https://cdn.jsdelivr.net/gh/anders-coder/cashback-meta-feed@main/images/avis_90e7be26_1x1.jpg,"https://cdn.jsdelivr.net/gh/anders-coder/cashback-meta-feed@main/images/avis_90e7be26_4x5.jpg,https://cdn.jsdelivr.net/gh/anders-coder/cashback-meta-feed@main/images/avis_90e7be26_9x16.jpg",Avis,Services,catalog,5 %,Services,online,05
019e16f7-5222-730b-83a0-e1afdc3fdbfe,BIVA — 4 % cashback,"BIVA blev i 2019 opkøbt af XL-Møbler. Efter opkøb, blev alle butikker lukket, og onlinehandel var den eneste mulighed for handel af møbler fra BIVA. Dog blev der i februar 2020, genåbnet et stort møbelhus i Ringe på Fyn.",in stock,new,0.00 DKK,https://cashbackmedvisa.dk/eshop/butikker/biva-1/019e16f7-5222-730b-83a0-e1afdc3fdbfe,https://cdn.jsdelivr.net/gh/anders-coder/cashback-meta-feed@main/images/biva-1_3c722fa8_1x1.jpg,"https://cdn.jsdelivr.net/gh/anders-coder/cashback-meta-feed@main/images/biva-1_3c722fa8_4x5.jpg,https://cdn.jsdelivr.net/gh/anders-coder/cashback-meta-feed@main/images/biva-1_3c722fa8_9x16.jpg",BIVA,Bolig & have,catalog,4 %,Bolig & have,online,04
019e16ea-5564-7096-ae63-a5bcd2bdda3c,daekonline.dk — 2 % cashback,"daekonline.dk by Delticom, Europas største online-dækhandel. Superpriser på dæk - top kvalitet, nemt og bekvemt.",in stock,new,0.00 DKK,https://cashbackmedvisa.dk/eshop/butikker/daekonline-dk/019e16ea-5564-7096-ae63-a5bcd2bdda3c,https://cdn.jsdelivr.net/gh/anders-coder/cashback-meta-feed@main/images/daekonline-dk_89405d28_1x1.jpg,"https://cdn.jsdelivr.net/gh/anders-coder/cashback-meta-feed@main/images/daekonline-dk_89405d28_4x5.jpg,https://cdn.jsdelivr.net/gh/anders-coder/cashback-meta-feed@main/images/daekonline-dk_89405d28_9x16.jpg",daekonline.dk,"Rejser, hotel & Transport",catalog,2 %,"Rejser, hotel & Transport",online,02
019e1727-ba8c-72dd-ba54-8a6496a7a6af,DAY ET — 5 % cashback,"Day ET startede oprindeligt som en del af modehuset Day Birger et Mikkelsen , men står i dag som et selvstændigt brand med en klar mission: At skabe tasker og tilbehør, der gør hverdagen lettere og smukkere for mennesker på farten. Brandet…",in stock,new,0.00 DKK,https://cashbackmedvisa.dk/eshop/butikker/day-et/019e1727-ba8c-72dd-ba54-8a6496a7a6af,https://cdn.jsdelivr.net/gh/anders-coder/cashback-meta-feed@main/images/day-et_a97e52c7_1x1.jpg,"https://cdn.jsdelivr.net/gh/anders-coder/cashback-meta-feed@main/images/day-et_a97e52c7_4x5.jpg,https://cdn.jsdelivr.net/gh/anders-coder/cashback-meta-feed@main/images/day-et_a97e52c7_9x16.jpg",DAY ET,Mode,catalog,5 %,Mode,online,05
019e1b39-12cd-71f1-9653-a0a1e67c7bfa,eesy mobil — 200 kr cashback,"eesy er et 100 % digitalt teleselskab. De gør mobiltelefoni nemt og matcher din digitale hverdag. Hos eesy skal du ikke vælge mellem en masse uigennemskuelige abonnementer med overflødigt fyld. eesy vil gerne give dig det, du har brug for…",in stock,new,0.00 DKK,https://cashbackmedvisa.dk/eshop/butikker/eesy-mobil/019e1b39-12cd-71f1-9653-a0a1e67c7bfa,https://cdn.jsdelivr.net/gh/anders-coder/cashback-meta-feed@main/images/eesy-mobil_f2ab4100_1x1.jpg,"https://cdn.jsdelivr.net/gh/anders-coder/cashback-meta-feed@main/images/eesy-mobil_f2ab4100_4x5.jpg,https://cdn.jsdelivr.net/gh/anders-coder/cashback-meta-feed@main/images/eesy-mobil_f2ab4100_9x16.jpg",eesy mobil,Services,catalog,200 kr,Services,online,00
019e1617-203c-709f-bd22-9c65dcb4b89f,HUGO BOSS — 5 % cashback,"Hos HUGO BOSS står kunden i fokus. Gennem lidenskab, kvalitet og personlighed er HUGO BOSS blevet et mærke med genkendelsesværdi. BOSS er herved mærket med alsidighed til en afvekslende hverdag. HUGO er mærket med en blanding af moderne…",in stock,new,0.00 DKK,https://cashbackmedvisa.dk/eshop/butikker/hugo-boss/019e1617-203c-709f-bd22-9c65dcb4b89f,https://cdn.jsdelivr.net/gh/anders-coder/cashback-meta-feed@main/images/hugo-boss_4ef8a0a9_1x1.jpg,"https://cdn.jsdelivr.net/gh/anders-coder/cashback-meta-feed@main/images/hugo-boss_4ef8a0a9_4x5.jpg,https://cdn.jsdelivr.net/gh/anders-coder/cashback-meta-feed@main/images/hugo-boss_4ef8a0a9_9x16.jpg",HUGO BOSS,Mode,catalog,5 %,Mode,online,05
019e16ea-4ac6-7208-ae93-099811237e58,JBL.com — 2 % cashback,"JBL bruger sin mangeårige erfaring til at skabe audio-udstyr til forbrugere i hele verden. JBL sælger HI-FI, hovedtelefoner, trådlyst udstyr, docks og bil audio.",in stock,new,0.00 DKK,https://cashbackmedvisa.dk/eshop/butikker/jbl.com/019e16ea-4ac6-7208-ae93-099811237e58,https://cdn.jsdelivr.net/gh/anders-coder/cashback-meta-feed@main/images/jbl-com_2c7184d7_1x1.jpg,"https://cdn.jsdelivr.net/gh/anders-coder/cashback-meta-feed@main/images/jbl-com_2c7184d7_4x5.jpg,https://cdn.jsdelivr.net/gh/anders-coder/cashback-meta-feed@main/images/jbl-com_2c7184d7_9x16.jpg",JBL.com,Elektronik,catalog,2 %,Elektronik,online,02
019e1727-137a-70fb-b9a6-fc1ab593e04c,Kaffepro — 5 % cashback,"KaffePro.dk er en webshop med fokus på kaffeoplevelser og kaffegrej, der forhandler alt fra kaffebønner og kaffemaskiner til udstyr og tilbehør til kaffeentusiaster.",in stock,new,0.00 DKK,https://cashbackmedvisa.dk/eshop/butikker/kaffepro/019e1727-137a-70fb-b9a6-fc1ab593e04c,https://cdn.jsdelivr.net/gh/anders-coder/cashback-meta-feed@main/images/kaffepro_28b80021_1x1.jpg,"https://cdn.jsdelivr.net/gh/anders-coder/cashback-meta-feed@main/images/kaffepro_28b80021_4x5.jpg,https://cdn.jsdelivr.net/gh/anders-coder/cashback-meta-feed@main/images/kaffepro_28b80021_9x16.jpg",Kaffepro,Dagligvarer,catalog,5 %,Dagligvarer,online,05
