id,title,description,availability,condition,price,link,image_link,additional_image_link,brand,product_type,custom_label_0,custom_label_1,custom_label_2,custom_label_3,custom_label_4
019e16fc-c90b-70af-b8f8-0cdcd00ea409,Lounge by Zalando — 4 % cashback,"Her byder hver dag på noget nyt. Oplev et udvalg på mere end 2.500 førende mode- og livsstilsmærker hver dag, og spar op til 75 %.",in stock,new,0.00 DKK,https://cashbackmedvisa.dk/eshop/butikker/zalando-lounge/019e16fc-c90b-70af-b8f8-0cdcd00ea409,https://cdn.jsdelivr.net/gh/anders-coder/cashback-meta-feed@main/images/zalando-lounge_8cdf2adc_1x1.jpg,"https://cdn.jsdelivr.net/gh/anders-coder/cashback-meta-feed@main/images/zalando-lounge_8cdf2adc_4x5.jpg,https://cdn.jsdelivr.net/gh/anders-coder/cashback-meta-feed@main/images/zalando-lounge_8cdf2adc_9x16.jpg",Lounge by Zalando,Mode,catalog,4 %,Mode,online,04
019e16fc-da13-71c2-ba6c-973126a4f01c,Lyca Mobile — 80 kr cashback,"Som verdens største internationale mobile netværksoperatør, tilbyder Lyca Mobile lavpris, højkvalitets data- og streaming til over 15 millioner kunder i 22 lande. Bemærk venligst: Denne kampagne kan kun bruges én gang per medlem.",in stock,new,0.00 DKK,https://cashbackmedvisa.dk/eshop/butikker/lyca-mobile/019e16fc-da13-71c2-ba6c-973126a4f01c,https://cdn.jsdelivr.net/gh/anders-coder/cashback-meta-feed@main/images/lyca-mobile_e444c941_1x1.jpg,"https://cdn.jsdelivr.net/gh/anders-coder/cashback-meta-feed@main/images/lyca-mobile_e444c941_4x5.jpg,https://cdn.jsdelivr.net/gh/anders-coder/cashback-meta-feed@main/images/lyca-mobile_e444c941_9x16.jpg",Lyca Mobile,Services,catalog,80 kr,Services,online,00
019ed4e7-6fa2-71f2-89ab-b303c0d096eb,Lyko — 5 % cashback,"Lyko samler hudpleje, hårpleje, makeup og parfume fra mange kendte mærker ét sted. Bestil favoritterne hjemmefra, og få varerne leveret direkte til døren. Et oplagt valg, når man vil forny rutinen eller finde en gave.",in stock,new,0.00 DKK,https://cashbackmedvisa.dk/eshop/butikker/lyko/019ed4e7-6fa2-71f2-89ab-b303c0d096eb,https://cdn.jsdelivr.net/gh/anders-coder/cashback-meta-feed@main/images/lyko_99ab70c8_1x1.jpg,"https://cdn.jsdelivr.net/gh/anders-coder/cashback-meta-feed@main/images/lyko_99ab70c8_4x5.jpg,https://cdn.jsdelivr.net/gh/anders-coder/cashback-meta-feed@main/images/lyko_99ab70c8_9x16.jpg",Lyko,Skønhed og Pleje,catalog,5 %,Skønhed og Pleje,online,05
019e16fc-ccb5-7143-ba36-5004f6f449e0,NordicFeel — 2 % cashback,"Vi tror på, at skønhed er mere end blot produkter; det er en helhedsoplevelse, en følelse af selvtillid og velvære. Vores nøje udformede guides og personlige anbefalinger er skabt for at forbedre din skønhedsrutine, samtidig med at de…",in stock,new,0.00 DKK,https://cashbackmedvisa.dk/eshop/butikker/nordicfeel/019e16fc-ccb5-7143-ba36-5004f6f449e0,https://cdn.jsdelivr.net/gh/anders-coder/cashback-meta-feed@main/images/nordicfeel_5dd7d61e_1x1.jpg,"https://cdn.jsdelivr.net/gh/anders-coder/cashback-meta-feed@main/images/nordicfeel_5dd7d61e_4x5.jpg,https://cdn.jsdelivr.net/gh/anders-coder/cashback-meta-feed@main/images/nordicfeel_5dd7d61e_9x16.jpg",NordicFeel,Mode,catalog,2 %,Mode,online,02
019e1617-0425-70ba-807a-7018a454e964,OiSTER — 200 kr cashback,"OiSTER er et teleselskab med fokus på billige mobilabonnementer, mobilt bredbånd og streaming. Grundlaget for OiSTER har altid været, at det skal være nemt og billigt at være OiSTER-kunde. Derfor skal du vælge OiSTER: - Du får 3's stærke…",in stock,new,0.00 DKK,https://cashbackmedvisa.dk/eshop/butikker/oister/019e1617-0425-70ba-807a-7018a454e964,https://cdn.jsdelivr.net/gh/anders-coder/cashback-meta-feed@main/images/oister_1a51ba63_1x1.jpg,"https://cdn.jsdelivr.net/gh/anders-coder/cashback-meta-feed@main/images/oister_1a51ba63_4x5.jpg,https://cdn.jsdelivr.net/gh/anders-coder/cashback-meta-feed@main/images/oister_1a51ba63_9x16.jpg",OiSTER,Services,catalog,200 kr,Services,online,00
019e1617-2187-72bd-8708-846866831553,PlusLED — 7 % cashback,"Hos PlusLED.dk finder du LED belysning i høj kvalitet til markedets bedste priser. De har både de kendte mærker, men også billige alternativer hvor der ikke er gået på kompromis med kvaliteten. PlusLED.dk er E-mærket, har fri fragt over…",in stock,new,0.00 DKK,https://cashbackmedvisa.dk/eshop/butikker/plusled/019e1617-2187-72bd-8708-846866831553,https://cdn.jsdelivr.net/gh/anders-coder/cashback-meta-feed@main/images/plusled_06a6e496_1x1.jpg,"https://cdn.jsdelivr.net/gh/anders-coder/cashback-meta-feed@main/images/plusled_06a6e496_4x5.jpg,https://cdn.jsdelivr.net/gh/anders-coder/cashback-meta-feed@main/images/plusled_06a6e496_9x16.jpg",PlusLED,Elektronik,catalog,7 %,Elektronik,online,07
019e1734-59f7-721d-8ccd-a2b793049e81,Robell — 6 % cashback,"Robell er et internationalt modebrand med over 30 års erfaring i at designe bukser og jeans specielt til kvinder — med fokus på komfort, pasform og stilfuldt design.",in stock,new,0.00 DKK,https://cashbackmedvisa.dk/eshop/butikker/robell/019e1734-59f7-721d-8ccd-a2b793049e81,https://cdn.jsdelivr.net/gh/anders-coder/cashback-meta-feed@main/images/robell_09274fcf_1x1.jpg,"https://cdn.jsdelivr.net/gh/anders-coder/cashback-meta-feed@main/images/robell_09274fcf_4x5.jpg,https://cdn.jsdelivr.net/gh/anders-coder/cashback-meta-feed@main/images/robell_09274fcf_9x16.jpg",Robell,Mode,catalog,6 %,Mode,online,06
019e16fc-d0cc-71da-9080-a4805f0d488d,SAMSUNG — 2 % cashback,"Velkommen til Samsung Danmark. Oplev et bredt udvalg af innovativ hjemmeelektronik og tekniske produkter, herunder smartphones, tablets, TV'er, og meget mere.",in stock,new,0.00 DKK,https://cashbackmedvisa.dk/eshop/butikker/samsung/019e16fc-d0cc-71da-9080-a4805f0d488d,https://cdn.jsdelivr.net/gh/anders-coder/cashback-meta-feed@main/images/samsung_38f73044_1x1.jpg,"https://cdn.jsdelivr.net/gh/anders-coder/cashback-meta-feed@main/images/samsung_38f73044_4x5.jpg,https://cdn.jsdelivr.net/gh/anders-coder/cashback-meta-feed@main/images/samsung_38f73044_9x16.jpg",SAMSUNG,Elektronik,catalog,2 %,Elektronik,online,02
019e1734-5d9c-7318-b781-76c95618815e,Shopdyner — 6 % cashback,"Shopdyner er en dansk webshop med fokus på dyner, puder og sengetilbehør – og tilbyder et bredt udvalg af fyldtyper, størrelser og tekstiler, så du kan finde den rette løsning til din søvnkomfort.",in stock,new,0.00 DKK,https://cashbackmedvisa.dk/eshop/butikker/shopdyner/019e1734-5d9c-7318-b781-76c95618815e,https://cdn.jsdelivr.net/gh/anders-coder/cashback-meta-feed@main/images/shopdyner_ccff5ae0_1x1.jpg,"https://cdn.jsdelivr.net/gh/anders-coder/cashback-meta-feed@main/images/shopdyner_ccff5ae0_4x5.jpg,https://cdn.jsdelivr.net/gh/anders-coder/cashback-meta-feed@main/images/shopdyner_ccff5ae0_9x16.jpg",Shopdyner,Bolig & have,catalog,6 %,Bolig & have,online,06
019e171d-3ca6-7153-8ade-fa6f43bb73de,Siemens Home — 3 % cashback,"Siemens er et globalt hvidevare brand kendt for tysk ingeniørkunst, innovativ teknologi og stilrent design til moderne hjem.",in stock,new,0.00 DKK,https://cashbackmedvisa.dk/eshop/butikker/siemens-home/019e171d-3ca6-7153-8ade-fa6f43bb73de,https://cdn.jsdelivr.net/gh/anders-coder/cashback-meta-feed@main/images/siemens-home_7fa34b68_1x1.jpg,"https://cdn.jsdelivr.net/gh/anders-coder/cashback-meta-feed@main/images/siemens-home_7fa34b68_4x5.jpg,https://cdn.jsdelivr.net/gh/anders-coder/cashback-meta-feed@main/images/siemens-home_7fa34b68_9x16.jpg",Siemens Home,Bolig & have,catalog,3 %,Bolig & have,online,03
019e171d-418e-710d-b7a7-908bd16f4e16,SIlkedyner — 6 % cashback,"Silkedyner.dk er en dansk specialbutik, som siden 2008 har haft fokus på silkedyner, silkepuder og tekstiler i silke til hele familien med kvalitet og komfort for øje.",in stock,new,0.00 DKK,https://cashbackmedvisa.dk/eshop/butikker/silkedyner/019e171d-418e-710d-b7a7-908bd16f4e16,https://cdn.jsdelivr.net/gh/anders-coder/cashback-meta-feed@main/images/silkedyner_11768b36_1x1.jpg,"https://cdn.jsdelivr.net/gh/anders-coder/cashback-meta-feed@main/images/silkedyner_11768b36_4x5.jpg,https://cdn.jsdelivr.net/gh/anders-coder/cashback-meta-feed@main/images/silkedyner_11768b36_9x16.jpg",SIlkedyner,Bolig & have,catalog,6 %,Bolig & have,online,06
019e16f7-5d95-7156-b99d-ec740103ccb4,StockX — 1 % cashback,"StockX er en online markedsplads og tøjforhandler, primært af sneakers. Siden november 2020 er der også åbnet op for elektroniske produkter som spillekonsoller, smartphones og computerhardware.",in stock,new,0.00 DKK,https://cashbackmedvisa.dk/eshop/butikker/stockx/019e16f7-5d95-7156-b99d-ec740103ccb4,https://cdn.jsdelivr.net/gh/anders-coder/cashback-meta-feed@main/images/stockx_da9cd117_1x1.jpg,"https://cdn.jsdelivr.net/gh/anders-coder/cashback-meta-feed@main/images/stockx_da9cd117_4x5.jpg,https://cdn.jsdelivr.net/gh/anders-coder/cashback-meta-feed@main/images/stockx_da9cd117_9x16.jpg",StockX,Mode,catalog,1 %,Mode,online,01
019e7382-c55d-728b-affa-d25c2a053ea7,Strawberry — 5 % cashback,"Hos Strawberry venter en verden af oplevelser – fra hoteller og restauranter til spa, konferencer og events. Med mere end 250 hoteller i Norden, Litauen og på Færøerne er der altid noget nyt at opdage. Strawberry handler om mere end…",in stock,new,0.00 DKK,https://cashbackmedvisa.dk/eshop/butikker/strawberry/019e7382-c55d-728b-affa-d25c2a053ea7,https://cdn.jsdelivr.net/gh/anders-coder/cashback-meta-feed@main/images/strawberry_ee63e194_1x1.jpg,"https://cdn.jsdelivr.net/gh/anders-coder/cashback-meta-feed@main/images/strawberry_ee63e194_4x5.jpg,https://cdn.jsdelivr.net/gh/anders-coder/cashback-meta-feed@main/images/strawberry_ee63e194_9x16.jpg",Strawberry,"Rejser, hotel & Transport",catalog,5 %,"Rejser, hotel & Transport",online,05
019e16f7-50e8-7084-9ae8-353161bfe3cd,Watery — 5 % cashback,Hos Watery løber vi alle ekstra stærkt for at kunne dele vores fælles passion for vandsport i alle dens afskygninger med endnu flere. Det er nemlig vores klare formål: At inspirere til bedre og flere oplevelser i og på vandet . Siden 2016…,in stock,new,0.00 DKK,https://cashbackmedvisa.dk/eshop/butikker/watery/019e16f7-50e8-7084-9ae8-353161bfe3cd,https://cdn.jsdelivr.net/gh/anders-coder/cashback-meta-feed@main/images/watery_40022c6e_1x1.jpg,"https://cdn.jsdelivr.net/gh/anders-coder/cashback-meta-feed@main/images/watery_40022c6e_4x5.jpg,https://cdn.jsdelivr.net/gh/anders-coder/cashback-meta-feed@main/images/watery_40022c6e_9x16.jpg",Watery,Sport & Fitness,catalog,5 %,Sport & Fitness,online,05
019e1b3f-b8a6-722c-9487-e28148ea8a1c,Witt — 5 % cashback,"På wittshop.dk finder dine brugere alt fra prisvindende juicepressere og high-end køkkenmaskiner til de nyeste pizzaovne og produkter til personlig pleje. Vi håndplukker de mest innovative brands som Sage, Everdure by Heston Blumenthal…",in stock,new,0.00 DKK,https://cashbackmedvisa.dk/eshop/butikker/witt/019e1b3f-b8a6-722c-9487-e28148ea8a1c,https://cdn.jsdelivr.net/gh/anders-coder/cashback-meta-feed@main/images/witt_19b9c397_1x1.jpg,"https://cdn.jsdelivr.net/gh/anders-coder/cashback-meta-feed@main/images/witt_19b9c397_4x5.jpg,https://cdn.jsdelivr.net/gh/anders-coder/cashback-meta-feed@main/images/witt_19b9c397_9x16.jpg",Witt,Bolig & have,catalog,5 %,Bolig & have,online,05
019e1734-5a84-70f9-9338-53c307e3a673,Worldmart — 6 % cashback,"Worldmart er et online supermarked med et stort udvalg af autentiske fødevarer og specialprodukter fra hele verden — fra Mellemøsten, Asien, Afrika til Latinamerika — leveret til Danmark.",in stock,new,0.00 DKK,https://cashbackmedvisa.dk/eshop/butikker/worldmart/019e1734-5a84-70f9-9338-53c307e3a673,https://cdn.jsdelivr.net/gh/anders-coder/cashback-meta-feed@main/images/worldmart_5af65eb6_1x1.jpg,"https://cdn.jsdelivr.net/gh/anders-coder/cashback-meta-feed@main/images/worldmart_5af65eb6_4x5.jpg,https://cdn.jsdelivr.net/gh/anders-coder/cashback-meta-feed@main/images/worldmart_5af65eb6_9x16.jpg",Worldmart,Dagligvarer,catalog,6 %,Dagligvarer,online,06
